<?xml version="1.0" encoding="UTF-8"?>
<?xml-stylesheet href="configuration2html.xsl" type="text/xsl"?>
<configuration
  xmlns="urn:strike-devices:configuration"
  xmlns:xsi="http://www.w3.org/2001/XMLSchema-instance"
  xsi:schemaLocation="urn:strike-devices:configuration java/mccf/configuration-def.xsd"
  def-lang-version="1"
  lang="en"
  prefix="CFG_"
  icon-path="configuration.png"
  xmlns:xi="http://www.w3.org/2001/XInclude">
  
  <title>Dual Strike Configuration</title>
  <title lang="de">Dual Strike Konfiguration</title>
  <help path="configuration-help.html"/>
  <help lang="de" path="configuration-help_de.html"/>
  
  <device>2</device>
  <version>1</version>
  
  <page>
    <title>Defaults</title>
    <title lang="de">Standards</title>
    <help>Configure the default settings of the Dual Strike.</help>
    <help lang="de">Konfiguration der Dual Strike Standardeinstellungen.</help>
    
    <choice prefix="DEF_WORK_MODE_" default="PS3">
      <title>Default Working Mode</title>
      <title lang="de">Standard Arbeitsmodus</title>
      <help>The working mode which is activated on plugging in, if no button to change the working mode is pressed.</help>
      <help lang="de">Der Arbeitsmodus der aktiviert wird, falls kein Button um den Arbeitsmodus zu ändern gedrückt wird.</help>
      
      <option id="PS3">
        <title>PS3/PC Controller</title>
        <help>The Dual Strike works as a PS3 and PC controller.</help>
        <help lang="de">Das Dual Strike arbeitet als PS3 und PC Controller.</help>
        <requires>PS3_ENABLED</requires>
        <requires>FOO</requires>
      </option>

      <option id="MAME">
        <title>MAME Keyboard</title>
        <title lang="de">MAME Tastatur</title>
        <help>The Dual Strike works as a MAME compatible keyboard.</help>
        <help lang="de">Das Dual Strike arbeitet als eine MAME kompatible Tastatur.</help>
        <requires>MAME_ENABLED</requires>
      </option>

      <option id="XBOX">
        <title>XBox Controller</title>
        <help>The Dual Strike works as a XBox1 controller.</help>
        <help lang="de">Das Dual Strike arbeitet als eine XBox1 Controller.</help>
        <requires>XBOX_ENABLED</requires>
      </option>
      
      <option id="PT">
        <title>Pass-Through (XBox360 or other)</title>
        <title lang="de">Durchschleifen (XBox360 oder andere)</title>
        <help>The pass-through data connections are routed to the USB data connections on the Dual Strike PCB.</help>
        <help lang="de">Die Durschleif-Datenanschlüsse werden auf die USB Datenanschlüsse des Dual Strike PCB geleitet.</help>
        <requires>PT_ENABLED</requires>
      </option>
    </choice>
    
    <boolean id="PS3_ENABLED" default="true">
        <title>PS3/PC Controller</title>
        <help>The Dual Strike works as a PS3 and PC controller.</help>
        <help lang="de">Das Dual Strike arbeitet als PS3 und PC Controller.</help>
    </boolean>

    <boolean id="MAME_ENABLED" default="true">
        <title>MAME Keyboard</title>
        <title lang="de">MAME Tastatur</title>
        <help>The Dual Strike works as a MAME compatible keyboard.</help>
        <help lang="de">Das Dual Strike arbeitet als eine MAME kompatible Tastatur.</help>
    </boolean>
    
    <boolean id="XBOX_ENABLED" default="true">
        <title>XBox Controller</title>
        <help>The Dual Strike works as a XBox1 controller.</help>
        <help lang="de">Das Dual Strike arbeitet als eine XBox1 Controller.</help>
    </boolean>
    
    <boolean id="PT_ENABLED" default="true">
        <title>Pass-Through (XBox360 or other)</title>
        <title lang="de">Durchschleifen (XBox360 oder andere)</title>
        <help>The pass-through data connections are routed to the USB data connections on the Dual Strike PCB.</help>
        <help lang="de">Die Durschleif-Datenanschlüsse werden auf die USB Datenanschlüsse des Dual Strike PCB geleitet.</help>
    </boolean>
    
    <choice default="FOO">
      <title>Blubber</title>
      <option id="FOO"><title>FOO</title></option>
      <option id="BAR"><title>BAR</title></option>
      <option id="FOO_BAR"><title>FOO BAR</title></option>
      <option id="BLUBB"><title>Blubb</title></option>
      <option id="BLOB"><title>Blob</title></option>
    </choice>
  </page>
</configuration>
